<?xml version="1.0" encoding="ISO-8859-1"?>
<!DOCTYPE locale_resources SYSTEM "file://locale_resources.dtd">

<locale_resources>
	<settings>
		<section name="delimiter">
			<param name="decimal">.</param>
			<param name="list">,</param>
		</section>
	</settings>
	<resources>
		<section name="profiler">
			<param name="msgDefault">Кодировка текста сообщений установлена в default (теперь вы не будете получать сообщения с русскими символами в тексте, даже если ваш телефон поддерживает ucs2 сообщения)</param>
			<param name="msgUCS2">Кодировка текста сообщений установлена в ucs2 (теперь вы сможете получать сообщения содержащие русские символы в тексте, однако ваш телефон должен поддерживать ucs2 сообщения)</param>
			<param name="msgLocaleChanged">Настройки locale успешно изменены</param>
			<param name="msgLocaleUnknown">Неправильно задан locale</param>
			<param name="msgHide">Включена hide опция</param>
			<param name="msgUnhide">Включена unhide опция</param>
			<param name="msgModificationDenied">У вас нет прав на изменение профиля</param>
			<param name="msgError"></param>
		</section>
		<section name="abonentinfo">
			<param name="smeFormat"></param>
		</section>
		<section name="receipt">
			<section name="default">
				<param name="deliveredFormat">*Сообщение на $$string import="dest"$$ доставлено $$date pattern="dd-MM-yy HH:mm:ss" import="date"$$</param>
				<param name="failedFormat">*Сообщение на $$string import="dest"$$ от $$date pattern="dd-MM-yy HH:mm:ss" import="date"$$ обломалось: $$string import="reason"$$. Пошлите сообщение на $$string import="dest"$$ еще раз и возможно вам повезет на этот раз. С уважением, smsc sme.</param>
				<param name="notifyFormat">$</param>
			</section>
			<section name="special">
				<param name="deliveredFormat">*=Сообщение на $$string import="dest"$$ доставлено $$date pattern="dd-MM-yy HH:mm:ss" import="date"$$</param>
				<param name="failedFormat">*=Сообщение на $$string import="dest"$$ от $$date pattern="dd-MM-yy HH:mm:ss" import="date"$$ обломалось: $$string import="reason"$$. Пошлите сообщение на $$string import="dest"$$ еще раз и возможно вам повезет на этот раз. С уважением, smsc sme.</param>
				<param name="notifyFormat">$=</param>
			</section>
		</section>
		<section name="reason">
			<param name="4">Неправильный тип соединения sme</param>
			<param name="20">Переполнение очереди</param>
			<param name="100">Временная ошибка</param>
			<param name="1026">Сообщение протухло</param>
			<param name="1027">Таймаут при доставке сообщения</param>
		</section>

		<section name="templates">
			<param name="t1">Привет $$string import="name" default="мир"$$</param>
			<param name="t2">Привет $$string import="name1" default="мир"$$ и $$string import="name2"$$ и все остальные. Перешлите это сообщение 10 своим друзьям. С приветом, мега темплейт.</param>
		</section>
	</resources>
</locale_resources>